{
  "schema_version": 1,
  "report_type": "mapscrape-run-audit",
  "generated_at": "2026-10-28T19:51:59.111Z",
  "application": "Tokenizaa/mapscrape-v2",
  "run": {
    "id": "job_1793216870262_r82zz",
    "user_id": "account:usr_19a2e9d1cb4122d1667f0cf89118a600",
    "segment": "Barbearias",
    "project_name": "Beleza Digital",
    "location": "São Paulo, SP",
    "limit_requested": 20,
    "status": "completed",
    "status_message": "Nenhum resultado visível na página pública do Google Maps.",
    "total_found": 0,
    "total_collected": 0,
    "total_duplicates": 0,
    "total_errors": 0,
    "current_step": "Nenhum resultado visível na página pública do Google Maps.",
    "created_at": "2026-10-28T19:47:50.262Z",
    "completed_at": "2026-10-28T19:51:56.658Z",
    "project_id": "prj_6b9f2ee19e624e53b96da9147cb6fbe0",
    "category_id": "cat_1b8b091420014da8904f66f1764af660"
  },
  "database": {
    "total_before": 11,
    "total_after": 11,
    "net_growth": 0,
    "records_saved_by_run": 0,
    "records_enriched_by_run": 0,
    "records_processed_by_run": 0,
    "records_saved_by_run_matches_job_counter": true
  },
  "collection": {
    "requested_limit": 20,
    "status": "completed",
    "total_found": 0,
    "total_collected": 0,
    "total_duplicates": 0,
    "total_errors": 0,
    "duplicate_only_run": false,
    "reached_successful_new_record_target": false,
    "scroll_attempts": 47,
    "reached_end_of_list": false,
    "new_candidates_found": 0
  },
  "data_quality": {
    "records_with_missing_fields": 0,
    "missing_field_frequency": {},
    "saved_records": [],
    "processed_records": []
  },
  "duplicates": [],
  "artifacts": {
    "json_file": "job_1793216870262_r82zz.json",
    "pdf_file": "job_1793216870262_r82zz.pdf",
    "pdf_generated": true
  },
  "audit": {
    "returned_count": 51,
    "total_matching_events": 51,
    "events": [
      {
        "id": "log_1793217431073_qdmeqhc",
        "created_at": "2026-10-28T19:57:11.073Z",
        "level": "info",
        "category": "scraper",
        "event": "results.scroll",
        "message": "Rolagem da lista de resultados executada e medida.",
        "job_id": "job_1793216870262_r82zz",
        "metadata": "{\"scrollAttempt\":20,\"target\":{\"x\":276,\"y\":380,\"beforeTop\":6590,\"maxTop\":6590,\"tag\":\"DIV\",\"className\":\"m6QErb DxyBCb kA9KIf dS8AEf XiKgde ecceSd QjC7t\",\"feedLinks\":42},\"evidence\":{\"scrollTop\":6590,\"scrollHeight\":7233,\"clientHeight\":643,\"visibleUniqueLinks\":40,\"firstUrl\":\"https://www.google.com/maps/place/S%C3%A3o+Paulo+Barbearia/data=!4m7!3m6!1s0x94ce57be30ae4773:0x7b6f0b8bb03f22c9!8m2!3d-23.5513389!4d-46.6911536!16s%2Fg%2F11c708rbc7!19sChIJc0euML5XzpQRySI_sIsLb3s\",\"lastUrl\":\"https://www.google.com/maps/place/Barbearia+Campo+Belo/data=!4m7!3m6!1s0x94ce5bfcfdb2680b:0x8ecde22a116d85d2!8m2!3d-23.6190258!4d-46.667156!16s%2Fg%2F11fsn7ngbt!19sChIJC2iy_fxbzpQR0oVtESrizY4\"},\"moved\":false,\"resumeCheckpoint\":\"https://www.google.com/maps/place/Barber+do+Neto/@-23.5527328,-46.6553689,17z/data=!4m7!3m6!1s0x94ce59d6a099b2ff:0x6f516e31e11bd821!8m2!3d-23.5527328!4d-46.6553689!10e1!16s%2Fg%2F11bwqpvrdr\",\"resumeReached\":false,\"resumeFallbackUsed\":false}"
      },
      {
        "id": "log_1793217385770_nyll5y3",
        "created_at": "2026-10-28T19:56:25.770Z",
        "level": "info",
        "category": "scraper",
        "event": "results.scroll",
        "message": "Rolagem da lista de resultados executada e medida.",
        "job_id": "job_1793216870262_r82zz",
        "metadata": "{\"scrollAttempt\":11,\"target\":{\"x\":276,\"y\":380,\"beforeTop\":6590,\"maxTop\":6590,\"tag\":\"DIV\",\"className\":\"m6QErb DxyBCb kA9KIf dS8AEf XiKgde ecceSd QjC7t\",\"feedLinks\":42},\"evidence\":{\"scrollTop\":6590,\"scrollHeight\":7233,\"clientHeight\":643,\"visibleUniqueLinks\":40,\"firstUrl\":\"https://www.google.com/maps/place/S%C3%A3o+Paulo+Barbearia/data=!4m7!3m6!1s0x94ce57be30ae4773:0x7b6f0b8bb03f22c9!8m2!3d-23.5513389!4d-46.6911536!16s%2Fg%2F11c708rbc7!19sChIJc0euML5XzpQRySI_sIsLb3s\",\"lastUrl\":\"https://www.google.com/maps/place/Barbearia+Campo+Belo/data=!4m7!3m6!1s0x94ce5bfcfdb2680b:0x8ecde22a116d85d2!8m2!3d-23.6190258!4d-46.667156!16s%2Fg%2F11fsn7ngbt!19sChIJC2iy_fxbzpQR0oVtESrizY4\"},\"moved\":false,\"resumeCheckpoint\":\"https://www.google.com/maps/place/Barber+do+Neto/@-23.5527328,-46.6553689,17z/data=!4m7!3m6!1s0x94ce59d6a099b2ff:0x6f516e31e11bd821!8m2!3d-23.5527328!4d-46.6553689!10e1!16s%2Fg%2F11bwqpvrdr\",\"resumeReached\":false,\"resumeFallbackUsed\":false}"
      },
      {
        "id": "log_1793217374391_qnuym20",
        "created_at": "2026-10-28T19:56:14.391Z",
        "level": "info",
        "category": "scraper",
        "event": "results.scroll",
        "message": "Rolagem da lista de resultados executada e medida.",
        "job_id": "job_1793216870262_r82zz",
        "metadata": "{\"scrollAttempt\":9,\"target\":{\"x\":276,\"y\":380,\"beforeTop\":6590,\"maxTop\":6590,\"tag\":\"DIV\",\"className\":\"m6QErb DxyBCb kA9KIf dS8AEf XiKgde ecceSd QjC7t\",\"feedLinks\":42},\"evidence\":{\"scrollTop\":6590,\"scrollHeight\":7233,\"clientHeight\":643,\"visibleUniqueLinks\":40,\"firstUrl\":\"https://www.google.com/maps/place/S%C3%A3o+Paulo+Barbearia/data=!4m7!3m6!1s0x94ce57be30ae4773:0x7b6f0b8bb03f22c9!8m2!3d-23.5513389!4d-46.6911536!16s%2Fg%2F11c708rbc7!19sChIJc0euML5XzpQRySI_sIsLb3s\",\"lastUrl\":\"https://www.google.com/maps/place/Barbearia+Campo+Belo/data=!4m7!3m6!1s0x94ce5bfcfdb2680b:0x8ecde22a116d85d2!8m2!3d-23.6190258!4d-46.667156!16s%2Fg%2F11fsn7ngbt!19sChIJC2iy_fxbzpQR0oVtESrizY4\"},\"moved\":false,\"resumeCheckpoint\":\"https://www.google.com/maps/place/Barber+do+Neto/@-23.5527328,-46.6553689,17z/data=!4m7!3m6!1s0x94ce59d6a099b2ff:0x6f516e31e11bd821!8m2!3d-23.5527328!4d-46.6553689!10e1!16s%2Fg%2F11bwqpvrdr\",\"resumeReached\":false,\"resumeFallbackUsed\":false}"
      },
      {
        "id": "log_1793217116290_ntes8hh",
        "created_at": "2026-10-28T19:51:56.290Z",
        "level": "info",
        "category": "scraper",
        "event": "job.finished",
        "message": "Nenhum resultado visível na página pública do Google Maps.",
        "job_id": "job_1793216870262_r82zz",
        "metadata": "{\"status\":\"completed\",\"totalFound\":0,\"totalCollected\":0,\"totalDuplicates\":0,\"totalErrors\":0,\"scrollAttempts\":47,\"reachedEndOfList\":false,\"databaseCountBefore\":11}"
      },
      {
        "id": "log_1793217114409_slh9ser",
        "created_at": "2026-10-28T19:51:54.409Z",
        "level": "info",
        "category": "scraper",
        "event": "results.scroll",
        "message": "Rolagem da lista de resultados executada e medida.",
        "job_id": "job_1793216870262_r82zz",
        "metadata": "{\"scrollAttempt\":47,\"target\":{\"x\":276,\"y\":380,\"beforeTop\":6590,\"maxTop\":6590,\"tag\":\"DIV\",\"className\":\"m6QErb DxyBCb kA9KIf dS8AEf XiKgde ecceSd QjC7t\",\"feedLinks\":42},\"evidence\":{\"scrollTop\":6590,\"scrollHeight\":7233,\"clientHeight\":643,\"visibleUniqueLinks\":40,\"firstUrl\":\"https://www.google.com/maps/place/S%C3%A3o+Paulo+Barbearia/data=!4m7!3m6!1s0x94ce57be30ae4773:0x7b6f0b8bb03f22c9!8m2!3d-23.5513389!4d-46.6911536!16s%2Fg%2F11c708rbc7!19sChIJc0euML5XzpQRySI_sIsLb3s\",\"lastUrl\":\"https://www.google.com/maps/place/Barbearia+Campo+Belo/data=!4m7!3m6!1s0x94ce5bfcfdb2680b:0x8ecde22a116d85d2!8m2!3d-23.6190258!4d-46.667156!16s%2Fg%2F11fsn7ngbt!19sChIJC2iy_fxbzpQR0oVtESrizY4\"},\"moved\":false,\"resumeCheckpoint\":\"https://www.google.com/maps/place/Barber+do+Neto/@-23.5527328,-46.6553689,17z/data=!4m7!3m6!1s0x94ce59d6a099b2ff:0x6f516e31e11bd821!8m2!3d-23.5527328!4d-46.6553689!10e1!16s%2Fg%2F11bwqpvrdr\",\"resumeReached\":true,\"resumeFallbackUsed\":true}"
      },
      {
        "id": "log_1793217108738_sdgf3wu",
        "created_at": "2026-10-28T19:51:48.738Z",
        "level": "info",
        "category": "scraper",
        "event": "results.scroll",
        "message": "Rolagem da lista de resultados executada e medida.",
        "job_id": "job_1793216870262_r82zz",
        "metadata": "{\"scrollAttempt\":46,\"target\":{\"x\":276,\"y\":380,\"beforeTop\":6590,\"maxTop\":6590,\"tag\":\"DIV\",\"className\":\"m6QErb DxyBCb kA9KIf dS8AEf XiKgde ecceSd QjC7t\",\"feedLinks\":42},\"evidence\":{\"scrollTop\":6590,\"scrollHeight\":7233,\"clientHeight\":643,\"visibleUniqueLinks\":40,\"firstUrl\":\"https://www.google.com/maps/place/S%C3%A3o+Paulo+Barbearia/data=!4m7!3m6!1s0x94ce57be30ae4773:0x7b6f0b8bb03f22c9!8m2!3d-23.5513389!4d-46.6911536!16s%2Fg%2F11c708rbc7!19sChIJc0euML5XzpQRySI_sIsLb3s\",\"lastUrl\":\"https://www.google.com/maps/place/Barbearia+Campo+Belo/data=!4m7!3m6!1s0x94ce5bfcfdb2680b:0x8ecde22a116d85d2!8m2!3d-23.6190258!4d-46.667156!16s%2Fg%2F11fsn7ngbt!19sChIJC2iy_fxbzpQR0oVtESrizY4\"},\"moved\":false,\"resumeCheckpoint\":\"https://www.google.com/maps/place/Barber+do+Neto/@-23.5527328,-46.6553689,17z/data=!4m7!3m6!1s0x94ce59d6a099b2ff:0x6f516e31e11bd821!8m2!3d-23.5527328!4d-46.6553689!10e1!16s%2Fg%2F11bwqpvrdr\",\"resumeReached\":true,\"resumeFallbackUsed\":true}"
      },
      {
        "id": "log_1793217103834_upey0v1",
        "created_at": "2026-10-28T19:51:43.834Z",
        "level": "info",
        "category": "scraper",
        "event": "results.scroll",
        "message": "Rolagem da lista de resultados executada e medida.",
        "job_id": "job_1793216870262_r82zz",